<?xml version="1.0" encoding="UTF-8"?>
<xs:schema xmlns:xs="http://www.w3.org/2001/XMLSchema" elementFormDefault="qualified">
	
	<xs:element name="employeeList">
		<xs:complexType>
			<xs:sequence>
				<xs:element ref="employee" maxOccurs="unbounded"/>
			</xs:sequence>
		</xs:complexType>
	</xs:element>
	
	<xs:element name="employee">
		<xs:complexType>
			<xs:sequence>
				<xs:element name="firstName" type="xs:string"/>
				<xs:element name="lastName" type="xs:string"/>
				<xs:element name="socialNumber" type="xs:string"/>
				<xs:element name="profile">
					<xs:complexType>
						<xs:sequence>
							<xs:element name="department" type="xs:string"/>
							<xs:element name="role" type="xs:string"/>
							<xs:element name="salary" type="xs:integer"/>
						</xs:sequence>
					</xs:complexType>
				</xs:element>
			</xs:sequence>
		</xs:complexType>
	</xs:element>
	
</xs:schema>